{
    "extensions": [
        {
            "type": "view",
            "location": "panel",
            "id": "resources",
            "title": "Application",
            "order": 70,
            "className": "Resources.ResourcesPanel",
            "tags": "pwa"
        },
        {
            "type": "@Common.Revealer",
            "contextTypes": [
                "SDK.Resource"
            ],
            "destination": "Application panel",
            "className": "Resources.ResourcesPanel.ResourceRevealer"
        }
    ],
    "dependencies": [
        "source_frame",
        "cookie_table",
        "inline_editor",
        "data_grid",
        "components",
        "object_ui",
        "perf_ui",
        "mobile_throttling",
        "network",
        "sources"
    ],
    "scripts": [
        "ApplicationCacheModel.js",
        "AppManifestView.js",
        "ApplicationCacheItemsView.js",
        "BackgroundServiceModel.js",
        "BackgroundServiceView.js",
        "ClearStorageView.js",
        "StorageItemsView.js",
        "CookieItemsView.js",
        "DatabaseModel.js",
        "DOMStorageModel.js",
        "DOMStorageItemsView.js",
        "DatabaseQueryView.js",
        "DatabaseTableView.js",
        "IndexedDBModel.js",
        "IndexedDBViews.js",
        "ResourcesPanel.js",
        "ApplicationPanelSidebar.js",
        "ResourcesSection.js",
        "ServiceWorkerCacheViews.js",
        "ServiceWorkersView.js"
    ],
    "resources": [
        "appManifestView.css",
        "backgroundServiceView.css",
        "clearStorageView.css",
        "indexedDBViews.css",
        "resourcesPanel.css",
        "resourcesSidebar.css",
        "serviceWorkerCacheViews.css",
        "serviceWorkersView.css"
    ]
}
