{
    "extensions": [
        {
            "type": "view",
            "location": "panel",
            "id": "cssoverview",
            "title": "CSS Overview",
            "className": "CssOverview.CSSOverviewPanel",
            "order": 95,
            "experiment": "cssOverview"
        }
    ],
    "dependencies": [
        "elements",
        "ui",
        "sdk",
        "data_grid",
        "extensions"
    ],
    "modules": [
        "CSSOverviewController.js",
        "CSSOverviewUnusedDeclarations.js",
        "CSSOverviewModel.js",
        "CSSOverviewStartView.js",
        "CSSOverviewProcessingView.js",
        "CSSOverviewCompletedView.js",
        "CSSOverviewSidebarPanel.js",
        "CSSOverviewPanel.js"
    ],
    "scripts": [],
    "resources": [
        "cssOverview.css",
        "cssOverviewStartView.css",
        "cssOverviewProcessingView.css",
        "cssOverviewCompletedView.css",
        "cssOverviewSidebarPanel.css"
    ]
  }
