{
    "dependencies": [
        "platform",
        "text_utils",
        "cm_headless"
    ],
    "scripts": [],
    "modules": [
        "formatter_worker.js",
        "../cm_web_modes/css.js",
        "../cm_web_modes/xml.js",
        "ESTreeWalker.js",
        "FormatterWorker.js",
        "acorn/acorn.js",
        "acorn/acorn_loose.js",
        "CSSFormatter.js",
        "AcornTokenizer.js",
        "JavaScriptFormatter.js",
        "FormattedContentBuilder.js",
        "CSSRuleParser.js",
        "HTMLFormatter.js",
        "IdentityFormatter.js",
        "JavaScriptOutline.js",
        "RelaxedJSONParser.js"
    ],
    "skip_compilation": [
        "acorn/acorn.js",
        "acorn/acorn_loose.js",
        "../cm_web_modes/css.js",
        "../cm_web_modes/xml.js"
    ]
}
