{
  "extensions": [
    {
      "type": "view",
      "location": "drawer-view",
      "id": "webauthn-pane",
      "title": "WebAuthn",
      "order": 100,
      "persistence": "closeable",
      "className": "Webauthn.WebauthnPane",
      "experiment": "webauthnPane"
    }
  ],
  "dependencies": [
    "common",
    "platform",
    "ui",
    "host"
  ],
  "scripts": [],
  "modules": [
    "webauthn.js",
    "WebauthnPane.js",
    "webauthn-legacy.js"
  ],
  "resources": [
    "webauthnPane.css"
  ]
}
