{
  "extensions": [
      {
          "type": "view",
          "location": "panel",
          "id": "media",
          "title": "Media",
          "persistence": "closeable",
          "order": 100,
          "className": "Media.MainView",
          "tags": "media, video",
          "experiment": "mediaInspector"
      }
  ],
  "dependencies": [
      "components",
      "sdk",
      "ui",
      "data_grid",
      "source_frame"
  ],
  "scripts": [
      "EventDisplayTable.js",
      "MainView.js",
      "PlayerDetailView.js",
      "PlayerListView.js",
      "PlayerPropertiesView.js",
      "MediaModel.js",
      "ChevronTabbedPanel.js"
  ],
  "resources": [
    "eventDisplayTable.css",
    "mediaView.css",
    "playerListView.css",
    "playerPropertiesView.css",
    "chevronTabbedPanel.css"
  ]
}