{
  "extensions": [
    {
      "type": "@QuickOpen.FilteredListWidget.Provider",
      "title": "Run command",
      "prefix": ">",
      "className": "QuickOpen.CommandMenuProvider"
    },
    {
      "type": "@QuickOpen.FilteredListWidget.Provider",
      "prefix": "?",
      "className": "QuickOpen.HelpQuickOpen"
    },
    {
      "type": "action",
      "actionId": "commandMenu.show",
      "category": "Global",
      "title": "Run command",
      "className": "QuickOpen.CommandMenu.ShowActionDelegate",
      "bindings": [
        {
          "platform": "windows,linux",
          "shortcut": "Ctrl+Shift+P",
          "keybindSets": ["devToolsDefault", "vsCode"]
        },
        {
          "platform": "mac",
          "shortcut": "Meta+Shift+P",
          "keybindSets": ["devToolsDefault", "vsCode"]
        },
        {
          "shortcut": "F1",
          "keybindSets": ["vsCode"]
        }
      ]
    },
    {
      "type": "context-menu-item",
      "location": "mainMenu/default",
      "actionId": "commandMenu.show"
    },
    {
      "type": "action",
      "actionId": "quickOpen.show",
      "category": "Global",
      "title": "Open file",
      "className": "QuickOpen.QuickOpen.ShowActionDelegate",
      "order": 100,
      "bindings": [
        {
          "platform": "mac",
          "shortcut": "Meta+P",
          "keybindSets": ["devToolsDefault", "vsCode"]
        },
        {
          "platform": "mac",
          "shortcut": "Meta+O",
          "keybindSets": ["devToolsDefault", "vsCode"]
        },
        {
          "platform": "windows,linux",
          "shortcut": "Ctrl+P",
          "keybindSets": ["devToolsDefault", "vsCode"]
        },
        {
          "platform": "windows,linux",
          "shortcut": "Ctrl+O",
          "keybindSets": ["devToolsDefault", "vsCode"]
        }
      ]
    },
    {
      "type": "context-menu-item",
      "location": "mainMenu/default",
      "actionId": "quickOpen.show"
    }
  ],
  "dependencies": [
    "ui",
    "diff"
  ],
  "scripts": [],
  "modules": [
    "quick_open.js",
    "quick_open-legacy.js",
    "FilteredListWidget.js",
    "QuickOpen.js",
    "CommandMenu.js",
    "HelpQuickOpen.js"
  ],
  "resources": [
    "filteredListWidget.css"
  ]
}
