{
    "extensions": [
        {
            "type": "early-initialization",
            "className": "WorkerMain.WorkerMain"
        }
    ],
    "dependencies": [
        "components",
        "mobile_throttling"
    ],
    "scripts": [],
    "modules": [
        "worker_main.js",
        "WorkerMain.js"
    ]
}
