{
  "dependencies": [],
  "scripts": [],
  "modules": [
    "cm_web_modes.js",
    "cm_web_modes_cm.js",
    "cm_web_modes_headless.js",
    "css.js",
    "javascript.js",
    "xml.js",
    "htmlmixed.js",
    "htmlembedded.js",
    "wast.js"
  ],
  "skip_compilation": [
    "css.js",
    "javascript.js",
    "xml.js",
    "htmlmixed.js",
    "htmlembedded.js",
    "wast.js"
  ]
}
