{
    "dependencies": [
        "ui",
        "common",
        "components",
        "sdk",
        "object_ui"
    ],
    "scripts": [],
    "modules": [
        "event_listeners.js",
        "EventListenersView.js",
        "EventListenersUtils.js"
    ],
    "resources": [
        "eventListenersView.css"
    ]
}
