{
    "dependencies": [
        "components",
        "sdk",
        "timeline_model",
        "ui",
        "perf_ui"
    ],
    "scripts": [],
    "modules": [
        "LayerDetailsView.js",
        "LayerTreeOutline.js",
        "LayerViewHost.js",
        "Layers3DView.js",
        "PaintProfilerView.js",
        "TransformController.js"
    ],
    "resources": [
        "layers3DView.css",
        "paintProfiler.css",
        "layerDetailsView.css"
    ]
}
