{
    "extensions": [
        {
            "type": "late-initialization",
            "className": "PerfUI.LiveHeapProfile",
            "experiment": "liveHeapProfile"
        },
        {
            "type": "@SourceFrame.LineDecorator",
            "className": "PerfUI.LineLevelProfile.LineDecorator",
            "decoratorType": "performance"
        },
        {
            "type": "@SourceFrame.LineDecorator",
            "className": "PerfUI.LineLevelProfile.LineDecorator",
            "decoratorType": "memory"
        },
        {
            "type": "setting",
            "category": "Performance",
            "title": "Flamechart mouse wheel action:",
            "settingName": "flamechartMouseWheelAction",
            "settingType": "enum",
            "defaultValue": "zoom",
            "options": [
                {
                    "title": "Scroll",
                    "text": "Scroll",
                    "value": "scroll"
                },
                {
                    "title": "Zoom",
                    "text": "Zoom",
                    "value": "zoom"
                }
            ]
        },
        {
            "type": "action",
            "actionId": "components.collect-garbage",
            "title": "Collect garbage",
            "iconClass": "largeicon-trash-bin",
            "className": "PerfUI.GCActionDelegate"
        }
    ],
    "dependencies": [
        "ui",
        "sdk",
        "bindings",
        "source_frame",
        "text_editor"
    ],
    "scripts": [
        "ChartViewport.js",
        "FilmStripView.js",
        "FlameChart.js",
        "GCActionDelegate.js",
        "LineLevelProfile.js",
        "LiveHeapProfile.js",
        "NetworkPriorities.js",
        "OverviewGrid.js",
        "PieChart.js",
        "TimelineGrid.js",
        "TimelineOverviewPane.js"
    ],
    "resources": [
        "chartViewport.css",
        "filmStripView.css",
        "flameChart.css",
        "overviewGrid.css",
        "pieChart.css",
        "timelineGrid.css",
        "timelineOverviewInfo.css"
    ]
}
